<!ELEMENT AEFALLOCATIONS (ALLOCATIONITEM+)>
<!ATTLIST AEFALLOCATIONS
	AEF CDATA #REQUIRED>
<!ELEMENT ALLOCATIONITEM EMPTY>
<!ATTLIST ALLOCATIONITEM
	taskid 	CDATA #REQUIRED
	requestor	CDATA #REQUIRED
	supplier	CDATA #REQUIRED
 	asset	 	CDATA #REQUIRED
	NSN		CDATA #REQUIRED
	quantity 	CDATA #REQUIRED>
