<?xml version="1.0" encoding="US-ASCII"?>
<!DOCTYPE AEFALLOCATIONS SYSTEM "AEFALLOCATIONS.dtd">
<AEFALLOCATIONS AEF="AEF1">
	<ALLOCATIONITEM
		taskid = "asdf"
		requestor = "421FS"
		supplier = "WRM"
		asset = "N2 Lite Cart"
		NSN = "12345"
		quantity = "5"/>
	<ALLOCATIONITEM
		taskid = "asdf"
		requestor = "421FS"
		supplier = "WRM"
		asset = "N2 Lite Cart"
		NSN = "12345"
		quantity = "5"/>
	<ALLOCATIONITEM
		taskid = "asdf"
		requestor = "421FS"
		supplier = "WRM"
		asset = "N2 Lite Cart"
		NSN = "12345"
		quantity = "5"/>
	<ALLOCATIONITEM
		taskid = "asdf"
		requestor = "421FS"
		supplier = "WRM"
		asset = "N2 Lite Cart"
		NSN = "12345"
		quantity = "5"/>
	<ALLOCATIONITEM
		taskid = "asdf"
		requestor = "421FS"
		supplier = "WRM"
		asset = "N2 Lite Cart"
		NSN = "12345"
		quantity = "5"/>
	<ALLOCATIONITEM
		taskid = "asdf"
		requestor = "421FS"
		supplier = "WRM"
		asset = "N2 Lite Cart"
		NSN = "12345"
		quantity = "5"/>
	<ALLOCATIONITEM
		taskid = "asdf"
		requestor = "421FS"
		supplier = "WRM"
		asset = "N2 Lite Cart"
		NSN = "12345"
		quantity = "5"/>
	<ALLOCATIONITEM
		taskid = "asdf"
		requestor = "421FS"
		supplier = "WRM"
		asset = "N2 Lite Cart"
		NSN = "12345"
		quantity = "5"/>
	<ALLOCATIONITEM
		taskid = "asdf"
		requestor = "421FS"
		supplier = "WRM"
		asset = "N2 Lite Cart"
		NSN = "12345"
		quantity = "5"/>
	<ALLOCATIONITEM
		taskid = "asdf"
		requestor = "421FS"
		supplier = "WRM"
		asset = "N2 Lite Cart"
		NSN = "12345"
		quantity = "5"/>
	<ALLOCATIONITEM
		taskid = "asdf"
		requestor = "421FS"
		supplier = "WRM"
		asset = "N2 Lite Cart"
		NSN = "12345"
		quantity = "5"/>
	<ALLOCATIONITEM
		taskid = "asdf"
		requestor = "421FS"
		supplier = "WRM"
		asset = "N2 Lite Cart"
		NSN = "12345"
		quantity = "5"/>
	<ALLOCATIONITEM
		taskid = "asdf"
		requestor = "421FS"
		supplier = "WRM"
		asset = "N2 Lite Cart"
		NSN = "12345"
		quantity = "5"/>
	<ALLOCATIONITEM
		taskid = "asdf"
		requestor = "421FS"
		supplier = "WRM"
		asset = "N2 Lite Cart"
		NSN = "12345"
		quantity = "5"/>
	<ALLOCATIONITEM
		taskid = "asdf"
		requestor = "421FS"
		supplier = "WRM"
		asset = "N2 Lite Cart"
		NSN = "12345"
		quantity = "5"/>
	<ALLOCATIONITEM
		taskid = "asdf"
		requestor = "421FS"
		supplier = "WRM"
		asset = "N2 Lite Cart"
		NSN = "12345"
		quantity = "5"/>
	<ALLOCATIONITEM
		taskid = "asdf"
		requestor = "421FS"
		supplier = "WRM"
		asset = "N2 Lite Cart"
		NSN = "12345"
		quantity = "5"/>
	<ALLOCATIONITEM
		taskid = "asdf"
		requestor = "421FS"
		supplier = "WRM"
		asset = "N2 Lite Cart"
		NSN = "12345"
		quantity = "5"/>
	<ALLOCATIONITEM
		taskid = "asdf"
		requestor = "421FS"
		supplier = "WRM"
		asset = "N2 Lite Cart"
		NSN = "12345"
		quantity = "5"/>
	<ALLOCATIONITEM
		taskid = "asdf"
		requestor = "421FS"
		supplier = "WRM"
		asset = "N2 Lite Cart"
		NSN = "12345"
		quantity = "5"/>
	<ALLOCATIONITEM
		taskid = "asdf"
		requestor = "421FS"
		supplier = "WRM"
		asset = "N2 Lite Cart"
		NSN = "12345"
		quantity = "5"/>
	<ALLOCATIONITEM
		taskid = "asdf"
		requestor = "421FS"
		supplier = "WRM"
		asset = "N2 Lite Cart"
		NSN = "12345"
		quantity = "5"/>
	<ALLOCATIONITEM
		taskid = "asdf"
		requestor = "421FS"
		supplier = "WRM"
		asset = "N2 Lite Cart"
		NSN = "12345"
		quantity = "5"/>
	<ALLOCATIONITEM
		taskid = "asdf"
		requestor = "421FS"
		supplier = "WRM"
		asset = "N2 Lite Cart"
		NSN = "12345"
		quantity = "5"/>
	<ALLOCATIONITEM
		taskid = "asdf"
		requestor = "421FS"
		supplier = "WRM"
		asset = "N2 Lite Cart"
		NSN = "12345"
		quantity = "5"/>
	<ALLOCATIONITEM
		taskid = "asdf"
		requestor = "421FS"
		supplier = "WRM"
		asset = "N2 Lite Cart"
		NSN = "12345"
		quantity = "5"/>
	<ALLOCATIONITEM
		taskid = "asdf"
		requestor = "421FS"
		supplier = "WRM"
		asset = "N2 Lite Cart"
		NSN = "12345"
		quantity = "5"/>
	<ALLOCATIONITEM
		taskid = "asdf"
		requestor = "421FS"
		supplier = "WRM"
		asset = "N2 Lite Cart"
		NSN = "12345"
		quantity = "5"/>
	<ALLOCATIONITEM
		taskid = "asdf"
		requestor = "421FS"
		supplier = "WRM"
		asset = "N2 Lite Cart"
		NSN = "12345"
		quantity = "5"/>
	<ALLOCATIONITEM
		taskid = "asdf"
		requestor = "421FS"
		supplier = "WRM"
		asset = "N2 Lite Cart"
		NSN = "12345"
		quantity = "5"/>
	<ALLOCATIONITEM
		taskid = "asdf"
		requestor = "421FS"
		supplier = "WRM"
		asset = "N2 Lite Cart"
		NSN = "12345"
		quantity = "5"/>
	<ALLOCATIONITEM
		taskid = "asdf"
		requestor = "421FS"
		supplier = "WRM"
		asset = "N2 Lite Cart"
		NSN = "12345"
		quantity = "5"/>
	<ALLOCATIONITEM
		taskid = "asdf"
		requestor = "421FS"
		supplier = "WRM"
		asset = "N2 Lite Cart"
		NSN = "12345"
		quantity = "5"/>
	<ALLOCATIONITEM
		taskid = "asdf"
		requestor = "421FS"
		supplier = "WRM"
		asset = "N2 Lite Cart"
		NSN = "12345"
		quantity = "5"/>
	<ALLOCATIONITEM
		taskid = "asdf"
		requestor = "421FS"
		supplier = "WRM"
		asset = "N2 Lite Cart"
		NSN = "12345"
		quantity = "5"/>
	<ALLOCATIONITEM
		taskid = "asdf"
		requestor = "421FS"
		supplier = "WRM"
		asset = "N2 Lite Cart"
		NSN = "12345"
		quantity = "5"/>
	<ALLOCATIONITEM
		taskid = "asdf"
		requestor = "421FS"
		supplier = "WRM"
		asset = "N2 Lite Cart"
		NSN = "12345"
		quantity = "5"/>
	<ALLOCATIONITEM
		taskid = "asdf"
		requestor = "421FS"
		supplier = "WRM"
		asset = "N2 Lite Cart"
		NSN = "12345"
		quantity = "5"/>
	<ALLOCATIONITEM
		taskid = "asdf"
		requestor = "421FS"
		supplier = "WRM"
		asset = "N2 Lite Cart"
		NSN = "12345"
		quantity = "5"/>
	<ALLOCATIONITEM
		taskid = "asdf"
		requestor = "421FS"
		supplier = "WRM"
		asset = "N2 Lite Cart"
		NSN = "12345"
		quantity = "5"/>
	<ALLOCATIONITEM
		taskid = "asdf"
		requestor = "421FS"
		supplier = "WRM"
		asset = "N2 Lite Cart"
		NSN = "12345"
		quantity = "5"/>
	<ALLOCATIONITEM
		taskid = "asdf"
		requestor = "421FS"
		supplier = "WRM"
		asset = "N2 Lite Cart"
		NSN = "12345"
		quantity = "5"/>
	<ALLOCATIONITEM
		taskid = "asdf"
		requestor = "421FS"
		supplier = "WRM"
		asset = "N2 Lite Cart"
		NSN = "12345"
		quantity = "5"/>
	<ALLOCATIONITEM
		taskid = "asdf"
		requestor = "421FS"
		supplier = "WRM"
		asset = "N2 Lite Cart"
		NSN = "12345"
		quantity = "5"/>
	<ALLOCATIONITEM
		taskid = "asdf"
		requestor = "421FS"
		supplier = "WRM"
		asset = "N2 Lite Cart"
		NSN = "12345"
		quantity = "5"/>
	<ALLOCATIONITEM
		taskid = "asdf"
		requestor = "421FS"
		supplier = "WRM"
		asset = "N2 Lite Cart"
		NSN = "12345"
		quantity = "5"/>
	<ALLOCATIONITEM
		taskid = "asdf"
		requestor = "421FS"
		supplier = "WRM"
		asset = "N2 Lite Cart"
		NSN = "12345"
		quantity = "5"/>
	<ALLOCATIONITEM
		taskid = "asdf"
		requestor = "421FS"
		supplier = "WRM"
		asset = "N2 Lite Cart"
		NSN = "12345"
		quantity = "5"/>
	<ALLOCATIONITEM
		taskid = "asdf"
		requestor = "421FS"
		supplier = "WRM"
		asset = "N2 Lite Cart"
		NSN = "12345"
		quantity = "5"/>
	<ALLOCATIONITEM
		taskid = "asdf"
		requestor = "421FS"
		supplier = "WRM"
		asset = "N2 Lite Cart"
		NSN = "12345"
		quantity = "5"/>
	<ALLOCATIONITEM
		taskid = "asdf"
		requestor = "421FS"
		supplier = "WRM"
		asset = "N2 Lite Cart"
		NSN = "12345"
		quantity = "5"/>
	<ALLOCATIONITEM
		taskid = "asdf"
		requestor = "421FS"
		supplier = "WRM"
		asset = "N2 Lite Cart"
		NSN = "12345"
		quantity = "5"/>
	<ALLOCATIONITEM
		taskid = "asdf"
		requestor = "421FS"
		supplier = "WRM"
		asset = "N2 Lite Cart"
		NSN = "12345"
		quantity = "5"/>
	<ALLOCATIONITEM
		taskid = "asdf"
		requestor = "421FS"
		supplier = "WRM"
		asset = "N2 Lite Cart"
		NSN = "12345"
		quantity = "5"/>
	<ALLOCATIONITEM
		taskid = "asdf"
		requestor = "421FS"
		supplier = "WRM"
		asset = "N2 Lite Cart"
		NSN = "12345"
		quantity = "5"/>
	<ALLOCATIONITEM
		taskid = "asdf"
		requestor = "421FS"
		supplier = "WRM"
		asset = "N2 Lite Cart"
		NSN = "12345"
		quantity = "5"/>
	<ALLOCATIONITEM
		taskid = "asdf"
		requestor = "421FS"
		supplier = "WRM"
		asset = "N2 Lite Cart"
		NSN = "12345"
		quantity = "5"/>
	<ALLOCATIONITEM
		taskid = "asdf"
		requestor = "421FS"
		supplier = "WRM"
		asset = "N2 Lite Cart"
		NSN = "12345"
		quantity = "5"/>
	<ALLOCATIONITEM
		taskid = "asdf"
		requestor = "421FS"
		supplier = "WRM"
		asset = "N2 Lite Cart"
		NSN = "12345"
		quantity = "5"/>
	<ALLOCATIONITEM
		taskid = "asdf"
		requestor = "421FS"
		supplier = "WRM"
		asset = "N2 Lite Cart"
		NSN = "12345"
		quantity = "5"/>
	<ALLOCATIONITEM
		taskid = "asdf"
		requestor = "421FS"
		supplier = "WRM"
		asset = "N2 Lite Cart"
		NSN = "12345"
		quantity = "5"/>
	<ALLOCATIONITEM
		taskid = "asdf"
		requestor = "421FS"
		supplier = "WRM"
		asset = "N2 Lite Cart"
		NSN = "12345"
		quantity = "5"/>
	<ALLOCATIONITEM
		taskid = "asdf"
		requestor = "421FS"
		supplier = "WRM"
		asset = "N2 Lite Cart"
		NSN = "12345"
		quantity = "5"/>
	<ALLOCATIONITEM
		taskid = "asdf"
		requestor = "421FS"
		supplier = "WRM"
		asset = "N2 Lite Cart"
		NSN = "12345"
		quantity = "5"/>
	<ALLOCATIONITEM
		taskid = "asdf"
		requestor = "421FS"
		supplier = "WRM"
		asset = "N2 Lite Cart"
		NSN = "12345"
		quantity = "5"/>
	<ALLOCATIONITEM
		taskid = "asdf"
		requestor = "421FS"
		supplier = "WRM"
		asset = "N2 Lite Cart"
		NSN = "12345"
		quantity = "5"/>
	<ALLOCATIONITEM
		taskid = "asdf"
		requestor = "421FS"
		supplier = "WRM"
		asset = "N2 Lite Cart"
		NSN = "12345"
		quantity = "5"/>
	<ALLOCATIONITEM
		taskid = "asdf"
		requestor = "421FS"
		supplier = "WRM"
		asset = "N2 Lite Cart"
		NSN = "12345"
		quantity = "5"/>
	<ALLOCATIONITEM
		taskid = "asdf"
		requestor = "421FS"
		supplier = "WRM"
		asset = "N2 Lite Cart"
		NSN = "12345"
		quantity = "5"/>